control_id,statement,category,severity,status,reason,remediation,source_doc_title,source_page
QCB-DP-P4-I8,Sensitive Financial Information must be classified as per a Financial Institution’s highest classification tier.,,,Error,LLM analysis failed,,Data Handling and Protection Regulation.pdf,4
QCB-DP-P4-I14,"Introduction As data is a cornerstone of financial operations, the secure handling and protection of sensitive information is a critical activity financial institutions must undertake.",,,Error,LLM analysis failed,,Data Handling and Protection Regulation.pdf,4
QCB-DP-P5-I1,"Organizational Governance 4.1 All data collected, stored, or processed by a Financial Institution or through a Third Party on behalf of a Financial Institution must be handled in accordance with QCB Law, this regulation, the Qatar Data Privacy Protection Law and any other relevant laws and regulations.",,,Error,LLM analysis failed,,Data Handling and Protection Regulation.pdf,5
QCB-DP-P5-I2,"4.2 A Financial Institution must establish a dedicated data governance business unit, or assign it to an existing function.",,,Error,LLM analysis failed,,Data Handling and Protection Regulation.pdf,5
QCB-DP-P5-I8,"4.3 A Financial Institution may establish a data governance committee with representation from senior management, risk, information technology, information security, legal and compliance as well as other relevant functions.",,,Error,LLM analysis failed,,Data Handling and Protection Regulation.pdf,5
QCB-DP-P5-I9,Such a committee may engage in tasks including: 4.3.1 Reviewing data privacy and protection risks.,,,Error,LLM analysis failed,,Data Handling and Protection Regulation.pdf,5
QCB-DP-P5-I12,"4.4 A Financial Institution must appoint a Data Privacy Officer (DPO) who possesses the necessary knowledge and experience in data privacy, notifying QCB of the appointed DPO and submit the required Fit and Proper Form as per QCB Licensing Regulations.",,,Error,LLM analysis failed,,Data Handling and Protection Regulation.pdf,5
QCB-DP-P5-I13,"1 A Financial Institution may appoint a DPO to an existing role, ensuring that it is independent of conflicts of interests and operate independently without being directed in the performance of their tasks.",,,Error,LLM analysis failed,,Data Handling and Protection Regulation.pdf,5
